{
  "schemaVersion": "1.0.0",
  "executionId": "exec-verifier-001",
  "paca": {
    "projectId": "SCRUM-PI",
    "taskId": "SPTS-VERIFY"
  },
  "agent": {
    "name": "verifier-agent",
    "role": "verifier"
  },
  "repository": {
    "root": "/home/paca/work/scrum-pi-team-skills"
  },
  "executionContext": {
    "process": "local-pi",
    "governedBy": "pi-daddy",
    "systemOfRecord": "paca"
  },
  "assurance": "critical",
  "resources": {
    "skills": ["skill:build", "skill:review"],
    "promptTemplates": ["prompt:principal-feature"]
  },
  "tools": ["read", "bash", "edit", "write"],
  "piDaddyGrant": "tool:read,tool:bash,tool:edit,tool:write",
  "delegation": {
    "maxDepth": 0
  },
  "authorization": {
    "objective": "Verify the authorized candidate evidence",
    "outOfScope": ["Do not modify the candidate"],
    "outOfScopeBehavior": "stop-and-report",
    "externalEffects": "prohibited"
  },
  "receiptPolicy": {
    "mode": "metadata-only",
    "includeTaskContent": false,
    "includePromptContent": false
  }
}
